{
  "$schema": "http://json-schema.org/draft-07/schema#",
  "$id": "edtech-cmf/lesson",
  "title": "Lesson",
  "description": "An instructional content unit. The atomic learning object in the framework.",
  "type": "object",
  "required": ["id", "type", "meta", "content", "localizationFlags"],
  "additionalProperties": false,

  "properties": {

    "id": {
      "type": "string",
      "pattern": "^lesson-[a-z0-9-]+$",
      "description": "Stable identifier. Never changes after creation. Example: lesson-intro-fractions"
    },

    "type": {
      "const": "lesson"
    },

    "meta": {
      "type": "object",
      "required": ["title", "language", "version", "status", "owner", "formality"],
      "properties": {
        "title":          { "type": "string" },
        "language":       {
          "type": "string",
          "pattern": "^[a-z]{2,3}(-[A-Za-z0-9]{2,8})*$",
          "description": "BCP-47 language tag. Examples: en, it, de, es-419, nl-BE"
        },
        "version":        { "type": "string", "pattern": "^\\d+\\.\\d+$", "description": "Semantic version: major.minor" },
        "status":         { "type": "string", "enum": ["draft", "cultural-review", "translation", "qa", "published", "archived"] },
        "owner":          { "type": "string", "description": "Name or role of the person responsible for this content" },
        "formality":      {
          "type": "string",
          "enum": ["formal", "informal", "neutral"],
          "description": "Register of address toward the learner. Determines pronoun and imperative form in all target languages. Set by the content author, not the translator."
        },
        "sourceLanguage": {
          "type": "string",
          "pattern": "^[a-z]{2,3}(-[A-Za-z0-9]{2,8})*$",
          "description": "BCP-47 tag of the language this was adapted from. Omit if this is the source."
        },
        "sourceId":       { "type": "string", "description": "ID of the source lesson this was adapted from" },
        "tags":           { "type": "array", "items": { "type": "string" } },
        "updatedAt":      { "type": "string", "format": "date" }
      },
      "additionalProperties": false
    },

    "content": {
      "type": "object",
      "required": ["objective", "body"],
      "properties": {

        "objective": {
          "type": "string",
          "description": "What the learner will be able to do after this lesson. One sentence, action-verb first."
        },

        "body": {
          "type": "array",
          "description": "Ordered list of content blocks",
          "items": {
            "type": "object",
            "required": ["blockType", "value"],
            "additionalProperties": false,
            "properties": {
              "blockType": { "type": "string", "enum": ["text", "image", "video", "callout", "example"] },
              "value":     { "type": "string" },
              "alt":       { "type": "string", "description": "Required when blockType is image. Describe the image for screen readers and non-visual contexts." },
              "caption":   { "type": "string" }
            },
            "if": {
              "properties": { "blockType": { "const": "image" } },
              "required": ["blockType"]
            },
            "then": {
              "required": ["alt"]
            }
          }
        },

        "keyTerms": {
          "type": "array",
          "description": "Terms that must not be paraphrased in translation. Used across lessons, questions, feedback and UI labels — define once here, reference by term name elsewhere.",
          "items": {
            "type": "object",
            "required": ["term", "definition"],
            "additionalProperties": false,
            "properties": {
              "term":       { "type": "string" },
              "definition": { "type": "string" }
            }
          }
        },

        "culturalNotes": {
          "type": "string",
          "description": "Notes for translators and reviewers: cultural context of examples used, tone intent, scenarios that may need adaptation. Not shown to learners."
        }

      },
      "additionalProperties": false
    },

    "localizationFlags": {
      "type": "object",
      "required": ["culturalReadinessScore"],
      "description": "Required on every content item. Signals content adaptability before translation begins.",
      "properties": {
        "containsHumor":          { "type": "boolean" },
        "containsLocalExamples":  { "type": "boolean" },
        "containsProperNouns":    { "type": "boolean" },
        "containsIdiom":          { "type": "boolean" },
        "textDirection":          {
          "type": "string",
          "enum": ["ltr", "rtl", "auto"],
          "description": "Text direction of the source content. Do not assume ltr. Default: ltr for Latin-script sources.",
          "default": "ltr"
        },
        "culturalReadinessScore": {
          "type": "integer",
          "minimum": 0,
          "maximum": 10,
          "description": "Assigned after completing the universal checklist. Sum of five category scores (0–2 each). Required before content can advance to cultural-review stage."
        },
        "localeReadiness": {
          "type": "array",
          "description": "Per-locale review results. Separate from the source readiness score — a content item can be source-ready but still require full rewrite for a specific locale.",
          "items": {
            "type": "object",
            "required": ["locale", "status", "reviewedBy", "reviewedAt"],
            "additionalProperties": false,
            "properties": {
              "locale":     { "type": "string", "pattern": "^[a-z]{2,3}(-[A-Za-z0-9]{2,8})*$" },
              "status":     { "type": "string", "enum": ["approved", "approved-with-notes", "requires-rewrite"] },
              "notes":      { "type": "string" },
              "reviewedBy": { "type": "string" },
              "reviewedAt": { "type": "string", "format": "date" }
            }
          }
        }
      },
      "additionalProperties": false
    }

  },

  "examples": [
    {
      "id": "lesson-intro-fractions",
      "type": "lesson",
      "meta": {
        "title": "What is a fraction?",
        "language": "en",
        "version": "1.0",
        "status": "published",
        "owner": "content-team",
        "formality": "informal",
        "tags": ["math", "beginner"],
        "updatedAt": "2026-10-15"
      },
      "content": {
        "objective": "Identify the numerator and denominator of a simple fraction.",
        "body": [
          { "blockType": "text", "value": "A fraction represents a part of a whole." },
          { "blockType": "image", "value": "fraction-diagram.png", "alt": "A circle divided into 4 equal parts with 1 part shaded, labelled 1/4.", "caption": "One quarter of a whole" },
          { "blockType": "example", "value": "If you cut a pizza into 4 slices and eat 1, you have eaten 1/4 of the pizza." }
        ],
        "keyTerms": [
          { "term": "numerator", "definition": "The top number in a fraction. Tells how many parts we have." },
          { "term": "denominator", "definition": "The bottom number in a fraction. Tells how many parts in total." }
        ],
        "culturalNotes": "Pizza example is appropriate for IT/EN contexts. For DE/NL consider a bread or Kuchen example. The fraction diagram relies on colour contrast — verify accessibility before adapting."
      },
      "localizationFlags": {
        "containsHumor": false,
        "containsLocalExamples": true,
        "containsProperNouns": false,
        "containsIdiom": false,
        "textDirection": "ltr",
        "culturalReadinessScore": 7,
        "localeReadiness": [
          {
            "locale": "it",
            "status": "approved",
            "notes": "Pizza example retained. Formality: tu register confirmed for this platform.",
            "reviewedBy": "giulia.m",
            "reviewedAt": "2026-10-15"
          }
        ]
      }
    }
  ]
}
